{
  "$schema": "../schemas/project-profile.schema.json",
  "version": 1,
  "layer_roles": {
    "ground": ["*/Ground"],
    "details": ["*/Details"]
  },
  "protected_layers": ["*/RuntimeMarkers"],
  "tilesets": {
    "res://Tiles/world.tres": {
      "aliases": {
        "grass_plain": {
          "source_id": 0,
          "atlas_x": 0,
          "atlas_y": 0,
          "alternative_id": 0
        },
        "flower_blue": {
          "source_id": 0,
          "atlas_x": 4,
          "atlas_y": 2,
          "alternative_id": 0
        }
      },
      "brushes": {
        "meadow": {
          "tiles": [
            { "tile": { "alias": "grass_plain" }, "weight": 8 },
            { "tile": { "alias": "flower_blue" }, "weight": 1 }
          ]
        }
      }
    }
  },
  "analysis": {
    "walk_mask_custom_data": "walk_mask",
    "force_block_custom_data": "force_block"
  },
  "limits": {
    "max_cells_per_edit": 50000,
    "max_render_pixels": 16777216
  },
  "extensions": {}
}
